[
 {
  "id": "err-rb2",
  "card": "ERR-RB2",
  "title": "Error anticipation on RewardBench 2",
  "science": "S16",
  "science_name": "Certified robustness, attack surface and eval-awareness",
  "science_raw": "S16-robustness",
  "verdict": "refuted",
  "kill_fired": "K-err",
  "kill_criteria": [
   {
    "comparator": "<=",
    "id": "K-err",
    "metric": "err_auroc_delta_min_family",
    "threshold": 0.0
   }
  ],
  "hypotheses": [
   {
    "id": "H-err-qwen",
    "statement": "internal features beat the exposed seen-pair margin at predicting held-out RB2 completion errors on Qwen3-8B",
    "metric": "err_auroc_delta_qwen8b",
    "comparator": ">",
    "threshold": 0.03,
    "ci_excludes": 0.0,
    "registered_prob": 0.6,
    "interval_prediction": null,
    "observed": -0.0009738428193937221,
    "outcome": "refuted",
    "scoreboard_row": null
   },
   {
    "id": "H-err-llama",
    "statement": "the same holds on Llama-8B (cross-family)",
    "metric": "err_auroc_delta_llama8b",
    "comparator": ">",
    "threshold": 0.03,
    "ci_excludes": 0.0,
    "registered_prob": null,
    "interval_prediction": null,
    "observed": -0.003470736845503808,
    "outcome": "refuted",
    "scoreboard_row": null
   }
  ],
  "adjudication_ev": "ev:6bf316c059230ff4ff99b118b1664631",
  "adjudicated_at": "2026-07-19T18:15:57.070447+00:00",
  "frozen_at": "2026-07-18T23:46:57.951556+00:00",
  "spec_hash": "spec:c8ac36e72adcc96a3d65b802efbce423",
  "spec_file": "campaign-err-rb2.json",
  "study_id": "study:campaign-err-rb2@v1#c8ac36e7",
  "figure": "card-err-rb2",
  "caption": "ERR-RB2 fired its kill criterion (K-err); the registered negative result.",
  "power_acceptance": {
   "power": 0.23125,
   "mde": 0.06812641830798699,
   "note": "delta-AUROC point call at its own 0.03 threshold under the label-shuffle refit null (null sd 0.0235, null pass rate at threshold 0.2013); the registered CI exclusion carries size control and deltas at or above the MDE confirm at 80 percent"
  },
  "inconclusive_reason": null,
  "companion_metrics": {
   "err_auroc_internal_qwen8b": 0.8580564710073929,
   "err_auroc_margin_qwen8b": 0.8590303138267866,
   "err_auroc_delta_qwen8b_ci_low": -0.004634508227426182,
   "err_auroc_delta_qwen8b_ci_high": 0.0023281954874443313,
   "err_auroc_internal_llama8b": 0.8728096018338405,
   "err_auroc_margin_llama8b": 0.8762803386793443,
   "err_auroc_delta_llama8b_ci_low": -0.005095063654071338,
   "err_auroc_delta_llama8b_ci_high": -0.0018241777525145248,
   "err_auroc_delta_min_family": -0.003470736845503808
  },
  "subjects": {
   "datasets": [
    "rb2-full"
   ],
   "extra": {
    "slice_hashes": {
     "rb2-full": "ds:92765fc94e2b8231914d5119670e53bc"
    }
   },
   "organisms": [],
   "signals": [
    "skywork-v2-qwen3-8b",
    "skywork-v2-llama31-8b"
   ]
  }
 },
 {
  "id": "forecast-cat",
  "card": "FORECAST-CAT",
  "title": "Benchmark forecasting from internals plus a 200-pair slice",
  "science": "S16",
  "science_name": "Certified robustness, attack surface and eval-awareness",
  "science_raw": "S16-robustness",
  "verdict": "mixed",
  "kill_fired": null,
  "kill_criteria": [
   {
    "comparator": ">=",
    "id": "K-forecast",
    "metric": "forecast_mae_minus_size_baseline",
    "threshold": 0.0
   }
  ],
  "hypotheses": [
   {
    "id": "H-forecast-mae",
    "statement": "internals plus a 200-pair slice forecast per-category RB2 accuracy within 0.06 MAE",
    "metric": "forecast_mae",
    "comparator": "<",
    "threshold": 0.06,
    "ci_excludes": null,
    "registered_prob": 0.55,
    "interval_prediction": null,
    "observed": 0.08695840679817465,
    "outcome": "refuted",
    "scoreboard_row": null
   },
   {
    "id": "H-forecast-beats-size",
    "statement": "the forecast beats predict-from-size",
    "metric": "forecast_mae_minus_size_baseline",
    "comparator": "<",
    "threshold": 0.0,
    "ci_excludes": 0.0,
    "registered_prob": null,
    "interval_prediction": null,
    "observed": -0.10242024172821523,
    "outcome": "confirmed",
    "scoreboard_row": null
   }
  ],
  "adjudication_ev": "ev:1acdc14e2fa16124786a9cd0d44a03b2",
  "adjudicated_at": "2026-07-19T18:16:08.710664+00:00",
  "frozen_at": "2026-07-18T23:46:57.951556+00:00",
  "spec_hash": "spec:39a99a5ab61d6f8e744a40b3804d21ab",
  "spec_file": "campaign-forecast-cat.json",
  "study_id": "study:campaign-forecast-cat@v1#39a99a5a",
  "figure": "card-forecast-cat",
  "caption": "FORECAST-CAT against its frozen predictions: mixed.",
  "power_acceptance": {
   "power": 0.28,
   "mde": 0.038059858890396744,
   "note": "P(observed MAE beats the no-skill null's 5 percent boundary 0.048 | true MAE at the frozen 0.06), 6 categories; a no-skill forecast passes the frozen bound itself 0.100 of the time, and true MAEs at or below 0.038 detect at 80 percent"
  },
  "inconclusive_reason": null,
  "companion_metrics": {
   "forecast_mae_minus_size_baseline_ci_low": -0.11965441047419614,
   "forecast_mae_minus_size_baseline_ci_high": -0.07469374333560999,
   "size_baseline_mae": 0.1893786485263899,
   "slice_baseline_mae": 0.17701517365910444
  },
  "subjects": {
   "datasets": [
    "rb2-full",
    "rb2-calibration-200"
   ],
   "extra": {
    "slice_hashes": {
     "rb2-calibration-200": "ds:5d06dd85dff04a8316286b03601a3c98",
     "rb2-full": "ds:92765fc94e2b8231914d5119670e53bc"
    }
   },
   "organisms": [],
   "signals": [
    "fleet"
   ]
  }
 },
 {
  "id": "style-rmb",
  "card": "STYLE-RMB",
  "title": "Bias battery predicts RM-Bench Hard ranking",
  "science": "S16",
  "science_name": "Certified robustness, attack surface and eval-awareness",
  "science_raw": "S16-robustness",
  "verdict": "inconclusive",
  "kill_fired": null,
  "kill_criteria": [
   {
    "comparator": ">=",
    "id": "K-style",
    "metric": "biasbattery_rmbench_perm_p",
    "threshold": 0.05
   }
  ],
  "hypotheses": [
   {
    "id": "H-style-transfer",
    "statement": "internal style susceptibility predicts the fleet's RM-Bench Hard ranking",
    "metric": "spearman_biasbattery_vs_rmbench_hard",
    "comparator": ">",
    "threshold": 0.6,
    "ci_excludes": null,
    "registered_prob": 0.5,
    "interval_prediction": null,
    "observed": null,
    "outcome": "inconclusive",
    "scoreboard_row": null
   },
   {
    "id": "H-style-perm",
    "statement": "the fleet-level correlation clears its permutation null",
    "metric": "biasbattery_rmbench_perm_p",
    "comparator": "<",
    "threshold": 0.05,
    "ci_excludes": null,
    "registered_prob": null,
    "interval_prediction": null,
    "observed": null,
    "outcome": "inconclusive",
    "scoreboard_row": null
   },
   {
    "id": "H-style-baseline",
    "statement": "the internal battery at least matches the behavioral degradation baseline",
    "metric": "spearman_minus_behavioral_baseline",
    "comparator": ">=",
    "threshold": 0.0,
    "ci_excludes": null,
    "registered_prob": null,
    "interval_prediction": null,
    "observed": null,
    "outcome": "inconclusive",
    "scoreboard_row": null
   }
  ],
  "adjudication_ev": "ev:14bc4c666b5b115cf1fd2c86cf209f01",
  "adjudicated_at": "2026-07-19T18:16:15.673725+00:00",
  "frozen_at": "2026-07-18T23:46:57.951556+00:00",
  "spec_hash": "spec:59c457674b4b4f6fc20df702d3e34785",
  "spec_file": "campaign-style-rmb.json",
  "study_id": "study:campaign-style-rmb@v1#59c45767",
  "figure": "card-style-rmb",
  "caption": "STYLE-RMB was not adjudicated this run: missing intermediate: no intermediate 'campaign.bias.battery' for roster_key='armorm' slice='diagnostic-v3-degradation'; the arc that produces it has not run or its shard was not merged.",
  "power_acceptance": null,
  "inconclusive_reason": "missing intermediate: no intermediate 'campaign.bias.battery' for roster_key='armorm' slice='diagnostic-v3-degradation'; the arc that produces it has not run or its shard was not merged",
  "companion_metrics": {},
  "subjects": {
   "datasets": [
    "rmbench-full",
    "diagnostic-v3"
   ],
   "extra": {
    "slice_hashes": {
     "diagnostic-v3": "ds:0554ebf282abe40a94b742e754838ab6",
     "rmbench-full": "ds:b663a2756518896abc9ef3650c9c7644"
    }
   },
   "organisms": [],
   "signals": [
    "fleet"
   ]
  }
 },
 {
  "id": "ppe-bon",
  "card": "PPE-BON",
  "title": "Tail index forecasts the best-of-k plateau on PPE",
  "science": "S3",
  "science_name": "Reward thermodynamics",
  "science_raw": "S03-thermo",
  "verdict": "inconclusive",
  "kill_fired": null,
  "kill_criteria": [
   {
    "comparator": "<=",
    "id": "K-ppe",
    "metric": "spearman_tail_vs_bon_plateau_ci_low",
    "threshold": 0.0
   }
  ],
  "hypotheses": [
   {
    "id": "H-tail-plateau",
    "statement": "the tail index predicts where best-of-k stops helping on the five PPE verifiable sets",
    "metric": "spearman_tail_vs_bon_plateau",
    "comparator": ">",
    "threshold": 0.3,
    "ci_excludes": 0.0,
    "registered_prob": 0.55,
    "interval_prediction": null,
    "observed": null,
    "outcome": "inconclusive",
    "scoreboard_row": null
   },
   {
    "id": "H-lowerquantile",
    "statement": "the lower-quantile best-of-n aggregation beats the mean against human labels, reproducing the PPE finding",
    "metric": "bon_lowerquantile_beats_mean",
    "comparator": "==",
    "threshold": 1.0,
    "ci_excludes": null,
    "registered_prob": null,
    "interval_prediction": null,
    "observed": null,
    "outcome": "inconclusive",
    "scoreboard_row": null
   }
  ],
  "adjudication_ev": "ev:5cd71da5713f2b2fb77697318b842401",
  "adjudicated_at": "2026-07-19T18:16:17.652441+00:00",
  "frozen_at": "2026-07-18T23:46:57.951556+00:00",
  "spec_hash": "spec:7077cf849ed8492fc327d970aa2ede55",
  "spec_file": "campaign-ppe-bon.json",
  "study_id": "study:campaign-ppe-bon@v1#7077cf84",
  "figure": "card-ppe-bon",